{
  "forecast_id": "fwaa-ceiling-reference-2026-07-28",
  "forecast_sha256": "6f4f507573120b9b31be628672479f50711e92411103e84cb6f9c70491789242",
  "input_sha256": "1082e75e3399a62458ed3db84fe73a75fee29fdb1afe0ade185f3d6283ab442b",
  "previous_record_sha256": null,
  "record_sha256": "b4e01b47650871f0820032c2a4315513300191f567a7ba3e3b9d8846d21997b5",
  "registered_at": "2026-07-28T16:00:00+00:00",
  "registry_version": "2.0.0",
  "research_cutoff": "2026-07-28T16:00:00+00:00",
  "score": null,
  "status": "demonstration-unscored",
  "target": {
    "direction": "higher_is_better",
    "horizon_end": "2028-07-28",
    "metric": "Realized verified missions per month",
    "question": "How many verified missions per month can this controlled system realize through July 2028 under changing technical capacity, adoption, and bottlenecks?",
    "scope": "Controlled reference system",
    "success_definition": "A mission is counted only after execution, verification, authorization, and acceptance.",
    "target_kind": "flow",
    "unit": "verified missions/month"
  }
}
