[
  {
    "registry_version": "2.0.0",
    "forecast_id": "fwaa-ceiling-reference-2026-07-28",
    "research_cutoff": "2026-07-28T16:00:00+00:00",
    "target": {
      "direction": "higher_is_better",
      "horizon_end": "2028-07-28",
      "metric": "Realized verified missions per month",
      "question": "How many verified missions per month can this controlled system realize through July 2028 under changing technical capacity, adoption, and bottlenecks?",
      "scope": "Controlled reference system",
      "success_definition": "A mission is counted only after execution, verification, authorization, and acceptance.",
      "target_kind": "flow",
      "unit": "verified missions/month"
    },
    "input_sha256": "1082e75e3399a62458ed3db84fe73a75fee29fdb1afe0ade185f3d6283ab442b",
    "forecast_sha256": "bc1ba04d4b3137537700d16ca1f429e7f0e16244b51e350539392ff684dd3655",
    "previous_record_sha256": null,
    "registered_at": "2026-07-28T16:00:00+00:00",
    "status": "demonstration-unscored",
    "score": null,
    "record_sha256": "f59501602aeb4dad4c40362b162d0c2e36b7b33e095090bdcdbc14ed1878b74a"
  }
]
